ID,Название,Регион,Район,Город,Район города,Адрес,Индекс,Телефон,Мобильный телефон,Email,Сайт,Рубрика,Подрубрика,Рейтинг,Кол-во отзывов,Кол-во оценок,whatsapp,telegram,vkontakte,Широта,Долгота
70000001057509736,"Дом Лента — ОБИ, гипермаркет товаров для ремонта, дома и сада",Москва,,Москва,Хорошёвский район,"Ходынский бульвар, 4",125252,"+7 (495) 777‒75‒75, 8‒800‒500‒80‒80",,info@obi.ru,"http://darim.domlenta.ru/, http://t.me/obi_russia","Автотовары, Автотранспорт, Аудио / Видео / Бытовая техника, Инструмент, Климатическое оборудование, Материалы для производства мебели, Мебель, Отделочные материалы, Охрана / Безопасность, Предметы интерьера / экстерьера, Промышленное оборудование, Садово-хозяйственные товары, Сантехническое оборудование, Спецмагазины, Средства связи, Строительное оборудование и техника, Строительные материалы / конструкции, Текстиль, Товары / услуги для животных, Химия / Вторсырьё, Художественные изделия / материалы, Электротехника","Автоаксессуары, Автоматические ворота / шлагбаумы, Автоматические двери, Автохимия, Антенны, Ароматовары, Бетон / Раствор, Бытовая техника, Вентиляционное / тепловое оборудование, Входные двери, Герметики / Клеи, Гидроизоляционные материалы, Гипсокартон, Декоративные аквасистемы, Декоративные отделочные элементы и материалы, Домашний текстиль, Домофоны, ДСП / ДВП / Фанера, Жалюзи, Заборы / Ограждения, Замки / Скобяные изделия, Звукоизоляционные материалы, Зоотовары, Интерьерные лестницы, Кабель / Провод, Карнизы, Керамическая плитка, Керамические изделия, Керамогранит, Кирпич, Кованые изделия, Комплектующие для дверей, Комплектующие для окон, Кондиционеры, Корпусная мебель, Котельное оборудование, Крепёж, Кровельные материалы, Лаки / Краски, ЛДСП / ДВПО / МДФ, Мебель для ванных комнат, Мебель для кухни, Мебельная фурнитура, Мебельные фасады, Межкомнатные двери, Металлорежущий инструмент, Напольные покрытия, Насосное оборудование, Натяжные потолки, Новогодние товары, Облицовочный камень, Обои, Огнезащитные материалы, Огнеупорные материалы, Окна, Оргстекло / Поликарбонат, Отделочные материалы, Охранные системы, Очистители воздуха, Перегородки, Песок / Щебень, Печи / камины для помещений, Пиломатериалы / Лесоматериалы, Погонажные изделия, Подвеска / Подсветка для картин, Подвесные потолки, Порошковые краски, Портьерные ткани / Шторы, Профессиональная химия, Резиновые покрытия, Рольставни, Садово-парковая мебель, Садовый инвентарь, Сантехника, Светопрозрачные конструкции, Светотехника, Сейфы, Сельхозтехника, Семена / Посадочный материал, Системы водоотведения, Слесарно-монтажный инструмент, Стекло / Зеркала, Стеновые панели, Строительное оборудование, Строительные блоки, Строительные гипермаркеты, Стройматериалы, Сухие строительные смеси, Сэндвич-панели, Теплицы, Теплоизоляционные материалы, Тёплые полы, Товары для отопления / водоснабжения / канализации, Тротуарная плитка, Фасадные материалы / конструкции, Хозтовары, Цемент, Чердачные лестницы, Электроизоляционные материалы, Электроинструмент, Электронагревательное оборудование, Электротехника, Электроустановочная продукция, Элементы питания","4,4",12,28,,,https://vk.com/domlenta_russia,55.788838,37.53354
70000001057696471,"Дом Лента — ОБИ, гипермаркет товаров для ремонта, дома и сада",Москва,,Москва,Сосенское поселение,"МКАД 41 километр, вл1",142704,"+7 (495) 777‒75‒75, 8‒800‒500‒80‒80",,info@obi.ru,"http://darim.domlenta.ru/, http://t.me/obi_russia","Автотовары, Автотранспорт, Аудио / Видео / Бытовая техника, Инструмент, Климатическое оборудование, Материалы для производства мебели, Мебель, Отделочные материалы, Охрана / Безопасность, Предметы интерьера / экстерьера, Промышленное оборудование, Садово-хозяйственные товары, Сантехническое оборудование, Спецмагазины, Средства связи, Строительное оборудование и техника, Строительные материалы / конструкции, Текстиль, Товары / услуги для животных, Химия / Вторсырьё, Художественные изделия / материалы, Электротехника","Автоаксессуары, Автоматические ворота / шлагбаумы, Автоматические двери, Автохимия, Антенны, Ароматовары, Бетон / Раствор, Бытовая техника, Вентиляционное / тепловое оборудование, Входные двери, Герметики / Клеи, Гидроизоляционные материалы, Гипсокартон, Декоративные аквасистемы, Декоративные отделочные элементы и материалы, Домашний текстиль, Домофоны, ДСП / ДВП / Фанера, Жалюзи, Заборы / Ограждения, Замки / Скобяные изделия, Звукоизоляционные материалы, Зоотовары, Интерьерные лестницы, Кабель / Провод, Карнизы, Керамическая плитка, Керамические изделия, Керамогранит, Кирпич, Кованые изделия, Комплектующие для дверей, Комплектующие для окон, Кондиционеры, Корпусная мебель, Котельное оборудование, Крепёж, Кровельные материалы, Лаки / Краски, ЛДСП / ДВПО / МДФ, Мебель для ванных комнат, Мебель для кухни, Мебельная фурнитура, Мебельные фасады, Межкомнатные двери, Металлорежущий инструмент, Напольные покрытия, Насосное оборудование, Натяжные потолки, Новогодние товары, Облицовочный камень, Обои, Огнезащитные материалы, Огнеупорные материалы, Окна, Оргстекло / Поликарбонат, Отделочные материалы, Охранные системы, Очистители воздуха, Перегородки, Песок / Щебень, Печи / камины для помещений, Пиломатериалы / Лесоматериалы, Погонажные изделия, Подвеска / Подсветка для картин, Подвесные потолки, Порошковые краски, Портьерные ткани / Шторы, Профессиональная химия, Резиновые покрытия, Рольставни, Садово-парковая мебель, Садовый инвентарь, Сантехника, Светопрозрачные конструкции, Светотехника, Сейфы, Сельхозтехника, Семена / Посадочный материал, Системы водоотведения, Слесарно-монтажный инструмент, Стекло / Зеркала, Стеновые панели, Строительное оборудование, Строительные блоки, Строительные гипермаркеты, Стройматериалы, Сухие строительные смеси, Сэндвич-панели, Теплицы, Теплоизоляционные материалы, Тёплые полы, Товары для отопления / водоснабжения / канализации, Тротуарная плитка, Фасадные материалы / конструкции, Хозтовары, Цемент, Чердачные лестницы, Электроизоляционные материалы, Электроинструмент, Электронагревательное оборудование, Электротехника, Электроустановочная продукция, Элементы питания","4,6",205,565,,,https://vk.com/domlenta_russia,55.60194,37.498185
70000001058741391,"Белый дом, торговая компания",Москва,,Москва,Тропарёво-Никулино район,"Востряковское шоссе, 7 ст6",119602,+7 (499) 399‒99‒90,,info@beldom62.ru,http://xn--80adxhks.xn--90agcqjin5h.xn--p1ai,"Архитектура / Проектирование / Дизайн, Строительные материалы / конструкции, Строительство зданий / сооружений","Архитектурное проектирование, Кирпич, Кровельные материалы, Системы водоотведения, Строительные блоки, Строительство дач / коттеджей, Стройматериалы, Сухие строительные смеси, Тротуарная плитка",,,2,+79209546326,https://t.me/beliydom_bot,https://vk.com/beldomrzn,55.661696,37.452523
70000001058879775,"Deppe Russia, представительство завода Deppe Backstein-Keramik GmbH в России",Москва,,Москва,,,,,+7‒963‒711‒49‒85,info@deppe-russia.ru,http://deppe-russia.ru,"Отделочные материалы, Строительные материалы / конструкции","Кирпич, Облицовочный камень, Сухие строительные смеси",,,1,+79637114985,,,,
70000001058891560,"Богандинский кирпич, торговая фирма",Москва,,Москва,Войковский район,"Головинское шоссе, 12",125212,+7 (495) 532‒99‒26,,zakaz@bogandinskij.ru,http://bogandinskij.ru,Строительные материалы / конструкции,"Кирпич, Тротуарная плитка",,,,+79269676181,,,55.837086,37.5014
70000001058891566,"Mortex Premium, магазин строительных материалов",Москва,,Москва,Войковский район,"Головинское шоссе, 12",125212,+7 (495) 152‒16‒71,,zakaz@mortex-premium.ru,http://mortex-premium.ru,Строительные материалы / конструкции,"Кирпич, Кровельные материалы, Сухие строительные смеси, Тротуарная плитка, Фасадные материалы / конструкции",,,,+79269318525,https://t.me/mortex_premium,,55.837086,37.5014
70000001059604396,"Красные крыши, группа компаний",Москва,,Москва,Пресненский район,"2-я Звенигородская улица, 13 ст43",123022,"+7 (495) 104‒64‒54, +7 (495) 106‒08‒61",,"idmitrydsgn@gmail.com, info@redroof.ru, moya@pochta.ru, spb@redroof.ru","http://jivo.chat/4Z45ztoQJk, http://t.me/redroofsofficial, http://www.redroofs.ru","Металлы, Строительные / монтажные работы, Строительные материалы / конструкции","Кирпич, Кровельные материалы, Кровельные работы, Металлоизделия, Фасадные материалы / конструкции",,,,,,https://vk.com/id572756632,55.762221,37.551735
70000001060234678,"Дом Лента — ОБИ, гипермаркет товаров для ремонта, дома и сада",Москва,,Москва,Чертаново Северное район,"Варшавское шоссе, 97",117556,"+7 (495) 777‒75‒75, 8‒800‒500‒80‒80",,info@obi.ru,"http://darim.domlenta.ru/, http://t.me/obi_russia","Автотовары, Автотранспорт, Аудио / Видео / Бытовая техника, Инструмент, Климатическое оборудование, Материалы для производства мебели, Мебель, Отделочные материалы, Охрана / Безопасность, Предметы интерьера / экстерьера, Промышленное оборудование, Садово-хозяйственные товары, Сантехническое оборудование, Спецмагазины, Средства связи, Строительное оборудование и техника, Строительные материалы / конструкции, Текстиль, Товары / услуги для животных, Химия / Вторсырьё, Художественные изделия / материалы, Электротехника","Автоаксессуары, Автоматические ворота / шлагбаумы, Автоматические двери, Автохимия, Антенны, Ароматовары, Бетон / Раствор, Бытовая техника, Вентиляционное / тепловое оборудование, Входные двери, Герметики / Клеи, Гидроизоляционные материалы, Гипсокартон, Декоративные аквасистемы, Декоративные отделочные элементы и материалы, Домашний текстиль, Домофоны, ДСП / ДВП / Фанера, Жалюзи, Заборы / Ограждения, Замки / Скобяные изделия, Звукоизоляционные материалы, Зоотовары, Интерьерные лестницы, Кабель / Провод, Карнизы, Керамическая плитка, Керамические изделия, Керамогранит, Кирпич, Кованые изделия, Комплектующие для дверей, Комплектующие для окон, Кондиционеры, Корпусная мебель, Котельное оборудование, Крепёж, Кровельные материалы, Лаки / Краски, ЛДСП / ДВПО / МДФ, Мебель для ванных комнат, Мебель для кухни, Мебельная фурнитура, Мебельные фасады, Межкомнатные двери, Металлорежущий инструмент, Напольные покрытия, Насосное оборудование, Натяжные потолки, Новогодние товары, Облицовочный камень, Обои, Огнезащитные материалы, Огнеупорные материалы, Окна, Оргстекло / Поликарбонат, Отделочные материалы, Охранные системы, Очистители воздуха, Перегородки, Песок / Щебень, Печи / камины для помещений, Пиломатериалы / Лесоматериалы, Погонажные изделия, Подвеска / Подсветка для картин, Подвесные потолки, Порошковые краски, Портьерные ткани / Шторы, Профессиональная химия, Резиновые покрытия, Рольставни, Садово-парковая мебель, Садовый инвентарь, Сантехника, Светопрозрачные конструкции, Светотехника, Сейфы, Сельхозтехника, Семена / Посадочный материал, Системы водоотведения, Слесарно-монтажный инструмент, Стекло / Зеркала, Стеновые панели, Строительное оборудование, Строительные блоки, Строительные гипермаркеты, Стройматериалы, Сухие строительные смеси, Сэндвич-панели, Теплицы, Теплоизоляционные материалы, Тёплые полы, Товары для отопления / водоснабжения / канализации, Тротуарная плитка, Фасадные материалы / конструкции, Хозтовары, Цемент, Чердачные лестницы, Электроизоляционные материалы, Электроинструмент, Электронагревательное оборудование, Электротехника, Электроустановочная продукция, Элементы питания",5,2,18,,,https://vk.com/domlenta_russia,55.633101,37.624299
70000001060946913,"Кирпич.ру, торговая компания",Москва,,Москва,Войковский район,"улица Космонавта Волкова, 12",127299,+7 (495) 480‒78‒45,,"buh@kirpich.ru, kirpich@kirpich.ru, marketing@kirpich.ru","http://kirpich.ru, http://t.me/kirpichru_msk",Строительные материалы / конструкции,"Железобетонные изделия, Кирпич, Строительные блоки, Стройматериалы, Сухие строительные смеси, Тротуарная плитка, Фасадные материалы / конструкции","4,9",33,34,,,https://vk.com/kirpich__ru,55.815645,37.518644
70000001061192353,"Фк металл, металл-сервис",Москва,,,Новофёдоровское поселение,"6-й Киевский переулок, 7 ст1",108806,,,mail@metcnal.ru,,"Бытовые услуги, Строительные материалы / конструкции","Кирпич, Пиломатериалы / Лесоматериалы, Пункты приёма, Стройматериалы, Сухие строительные смеси, Теплоизоляционные материалы",,,,+79771081111,,,55.473247,36.930155
70000001061379157,"ОКЗ, склад",Москва,,Москва,Сосенское поселение,"улица Адмирала Корнилова, 18",108802,+7 (495) 966‒23‒99,,"commerce@rukirpich.ru, info@rukirpich.ru",http://www.rukirpich.ru,Строительные материалы / конструкции,Кирпич,,,,,,,55.608824,37.450002
70000001061755751,"Стройкомплект, компания по продаже строительных материалов",Москва,,Зеленоград,Савёлки район,"Зеленоград, к322а",124482,"+7 (495) 150‒05‒25, +7 (499) 322‒10‒29, +7 (499) 490‒20‒47, 8‒800‒707‒51‒21","+7‒925‒705‒40‒28, +7‒925‒707‒62‒77","db@strd.ru, dmd@strd.ru, dmi@strd.ru, dp@strd.ru, go@strd.ru, info@strd.ru, is@strd.ru, ivan@gmail.com, kaluga@strd.ru, kd@strd.ru, kl@strd.ru, klin@strd.ru, ks@strd.ru, mk@strd.ru, ml@strd.ru, moj@strd.ru, ms@strd.ru, mt@strd.ru, mv@strd.ru, nn@strd.ru, no@strd.ru, ob@strd.ru, ra@strd.ru, ram@strd.ru, sa@strd.ru, sch@strd.ru, sh@strd.ru, sk137@strd.ru, sk157@strd.ru, sk19@strd.ru, sk197@strd.ru, sk23@strd.ru, sk93@strd.ru, so@strd.ru, sp@strd.ru, spb@strd.ru, su@strd.ru, tl@strd.ru, tv@strd.ru, vi@strd.ru, vs@strd.ru, zl@strd.ru",http://strd.ru,"Отделочные материалы, Строительные материалы / конструкции","Гидроизоляционные материалы, ДСП / ДВП / Фанера, Железобетонные изделия, Заборы / Ограждения, Звукоизоляционные материалы, Кирпич, Кровельные материалы, Оргстекло / Поликарбонат, Пиломатериалы / Лесоматериалы, Строительные блоки, Стройматериалы, Сухие строительные смеси, Сэндвич-панели, Теплоизоляционные материалы, Тротуарная плитка, Фасадные материалы / конструкции",5,1,1,"+79257054028, +79257076277",https://t.me/strdru,,55.996746,37.214794
70000001061851321,"Скрябин Керамикс, торговый дом",Москва,,Москва,Академический район,"Большая Черёмушкинская улица, 34",117218,,"+7‒916‒544‒06‒24, +7‒932‒698‒96‒25, +7‒977‒090‒02‒89, +7‒977‒090‒03‒31","kirill@skriabin-ceramics.ru, sales@skriabin-ceramics.ru",http://skriabin-ceramics.ru,"Отделочные материалы, Строительные материалы / конструкции","Керамическая плитка, Кирпич, Тротуарная плитка, Фасадные материалы / конструкции",5,24,25,+79223988422,https://t.me/+79223988422,https://vk.com/skriabin_ceramics,55.678945,37.583245
70000001062554725,Студия идеального камня,Москва,,Москва,Котловка район,"Нахимовский проспект, 24 пав3",117218,+7 (495) 003‒52‒69,"+7‒916‒489‒44‒54, +7‒968‒398‒77‒90","idealstone24@mail.ru, info@idealstone.ru",http://idealstone.ru,"Отделочные материалы, Строительные материалы / конструкции","Кирпич, Облицовочный камень, Тротуарная плитка, Фасадные материалы / конструкции",,,,+79164894454,https://t.me/idealstone_msk,https://vk.com/gkidealstone,55.671179,37.585736
70000001062894041,"Bogart, компания",Москва,,Москва,Даниловский район,"улица Ленинская Слобода, 26 ст28",115280,+7 (499) 288‒82‒80,,"89200200370@bogart.su, info@bogart.su, rb@bblb.ru","http://bogart.su, http://msk.bogart.su",Строительные материалы / конструкции,"Кирпич, Строительные блоки, Тротуарная плитка",,,,,,,55.71262,37.65387
70000001062900741,"Москлинкер, торговая компания",Москва,,Москва,Очаково-Матвеевское район,"Очаковское шоссе, 28 ст2",119530,"+7 (495) 646‒89‒10, 8‒800‒500‒56‒89",+7‒915‒001‒52‒62,dom@mosklinker.ru,http://mosklinker.ru,"Отделочные материалы, Строительные / монтажные работы, Строительные материалы / конструкции","Керамическая плитка, Кирпич, Отделочные материалы, Тротуарная плитка, Фасадные материалы / конструкции, Фасадные работы",5,1,1,+79660196929,,https://vk.com/mosklinker,55.685903,37.441959
